disease,symptoms
Plantar warts,"A small, rough growth on the bottom of your foot, usually at the base of the toes or on the ball or heel, On brown and Black skin, the growth may be lighter than unaffected skin, Hard, thickened skin (callus) over a spot on the skin, where a wart has grown inward, Black pinpoints, which are small clotted blood vessels commonly called wart seeds, A cluster of growths on the sole of the foot (mosaic warts), A growth that interrupts the normal lines and ridges in the skin of your foot, Pain or tenderness when walking or standing"
Pleurisy,"Chest pain that worsens when you breathe, cough or sneeze, Shortness of breath — often from trying to limit breathing in and out, Cough — only in some cases, Fever — only in some cases"
"Pleuritis, also known asPleurisy","Chest pain that worsens when you breathe, cough or sneeze, Shortness of breath — often from trying to limit breathing in and out, Cough — only in some cases, Fever — only in some cases"
"PLS, also known asPrimary lateral sclerosis (PLS)","Stiffness, weakness and muscle spasms (spasticity) in your legs, rarely starting in one leg, and eventually progressing to your arms, hands, tongue and jaw, Slowed movement, Tripping, clumsiness and difficulty with balance, Hand clumsiness, Hoarseness, as well as slowed, slurred speech and drooling, Difficulties with chewing and swallowing, Sometimes, frequent, rapid and intense shifts in emotions (mood lability), Rarely, breathing problems and bladder problems late in the disease"
Pneumonia,"Chest pain when you breathe or cough, Confusion or changes in mental awareness (in adults age 65 and older), Cough, which may produce phlegm, Fatigue, Fever, sweating and shaking chills, Lower than normal body temperature (in adults older than age 65 and people with weak immune systems), Nausea, vomiting or diarrhea, Shortness of breath"
Pneumonitis,"Shortness of breath, Cough, Fatigue, Loss of appetite, Unintentional weight loss"
Pneumothorax,"Chest injury. Any blunt or penetrating injury to your chest can cause lung collapse. Some injuries may happen during physical assaults or car crashes, while others may inadvertently occur during medical procedures that involve the insertion of a needle into the chest., Lung disease. Damaged lung tissue is more likely to collapse. Lung damage can be caused by many types of underlying diseases, such as chronic obstructive pulmonary disease (COPD), cystic fibrosis, lung cancer or pneumonia. Cystic lung diseases, such as lymphangioleiomyomatosis and Birt-Hogg-Dube syndrome, cause round, thin-walled air sacs in the lung tissue that can rupture, resulting in pneumothorax., Ruptured air blisters. Small air blisters (blebs) can develop on the top of the lungs. These air blisters sometimes burst — allowing air to leak into the space that surrounds the lungs., Mechanical ventilation. A severe type of pneumothorax can occur in people who need mechanical assistance to breathe. The ventilator can create an imbalance of air pressure within the chest. The lung may collapse completely."
Poison ivy rash,"Redness, Itching, Swelling, Blisters, Difficulty breathing, if you've inhaled the smoke from burning poison ivy"
Polio,"Fever, Headache, Muscle aches, Sore throat, Stomachache, Loss of appetite, Nausea, Vomiting"
Polycystic kidney disease,"High blood pressure, Back or side pain, Blood in your urine, A feeling of fullness in your abdomen, Increased size of your abdomen due to enlarged kidneys, Headaches, Kidney stones, Kidney failure, Urinary tract or kidney infections"
Polycystic ovary syndrome (PCOS),"Irregular periods. Having few menstrual periods or having periods that aren't regular are common signs of PCOS. So is having periods that last for many days or longer than is typical for a period. For example, you might have fewer than nine periods a year. And those periods may occur more than 35 days apart. You may have trouble getting pregnant., Too much androgen. High levels of the hormone androgen may result in excess facial and body hair. This is called hirsutism. Sometimes, severe acne and male-pattern baldness can happen, too., Polycystic ovaries. Your ovaries might be bigger. Many follicles containing immature eggs may develop around the edge of the ovary. The ovaries might not work the way they should."
Polycythemia vera,"Itchiness, especially after a warm bath or shower, Numbness, tingling, burning, or weakness in your hands, feet, arms or legs, A feeling of fullness soon after eating and bloating or pain in your left upper abdomen due to an enlarged spleen, Unusual bleeding, such as a nosebleed or bleeding gums, Painful swelling of one joint, often the big toe, Shortness of breath and difficulty breathing when lying down"
Polyhydramnios,"Shortness of breath or the inability to breathe, Swelling in the lower extremities and abdominal wall, Uterine discomfort or contractions, Fetal malposition, such as breech presentation"
Polymorphous light eruption,"Dense clusters of small bumps and blisters, Inflamed, raised rough patches, Itching or burning"
Polymyalgia rheumatica,"Aches or pain in your shoulders, Aches or pain in your neck, upper arms, buttocks, hips or thighs, Stiffness in affected areas, particularly in the morning or after being inactive for a time, Limited range of motion in affected areas, Pain or stiffness in your wrists, elbows or knees"
Polymyositis,"Difficulty swallowing. If the muscles in your esophagus are affected, you may have problems swallowing (dysphagia), which in turn may cause weight loss and malnutrition., Aspiration pneumonia. Difficulty swallowing may also cause you to breathe food or liquids, including saliva, into your lungs (aspiration), which can lead to pneumonia., Breathing problems. If your chest muscles are affected by the disease, you may experience breathing problems, such as shortness of breath or, in severe cases, respiratory failure."
"Polyps, colon, also known asColon polyps","Change in bowel habits. Constipation or diarrhea that lasts longer than a week may mean the presence of a larger colon polyp or cancer. However, several other conditions also can cause changes in bowel habits., Change in stool color. Blood can show up as red streaks in your stool or make stool appear black. A change in color also may be caused by certain foods, medicines or dietary supplements., Iron deficiency anemia. Bleeding from polyps can happen slowly over time, without visible blood in your stool. Chronic bleeding may lead to iron deficiency anemia, which can make you feel tired and short of breath., Pain. A large colon polyp can block part of your bowel, leading to crampy abdominal pain., Rectal bleeding. This can be a sign of colon polyps or cancer or other conditions, such as hemorrhoids or minor tears of the anus."
"Polyps, endometrial, also known asUterine polyps","Vaginal bleeding after menopause., Bleeding between periods., Frequent, unpredictable periods whose lengths and heaviness vary., Very heavy periods., Infertility."
"Polyps, nasal, also known asNasal polyps","A runny nose, Persistent stuffiness, Postnasal drip, Decreased or absent sense of smell, Loss of sense of taste, Facial pain or headache, Pain in your upper teeth, A sense of pressure over your forehead and face, Snoring, Frequent nosebleeds"
"Polyps, stomach, also known asStomach polyps","Pain or tenderness when you press your stomach, Nausea, Blood in your stool, Anemia"
"Polyps, uterine, also known asUterine polyps","Vaginal bleeding after menopause., Bleeding between periods., Frequent, unpredictable periods whose lengths and heaviness vary., Very heavy periods., Infertility."
"Pompholyx, also known asDyshidrosis","Stress. Dyshidrosis appears to be more common during times of emotional or physical stress., Exposure to certain metals. These include cobalt and nickel — usually in an industrial setting., Sensitive skin. People who develop a rash after contact with certain irritants are more likely to experience dyshidrosis., Atopic dermatitis. Some people with atopic dermatitis may develop dyshidrotic eczema."
"Poor color vision, also known asColor blindness","Different shades of red and green, Different shades of blue and yellow, Any colors"
Popliteal artery aneurysm,"Knee pain, Lower leg pain, Swelling behind the knee, Pulsing sensation behind the knee"
Popliteal artery entrapment syndrome,"Cold feet after exercise, Tingling or burning in your calf (paresthesia), Numbness in the calf area"
"Popliteal cyst, also known asBaker cyst","Swelling behind the knee, and sometimes in the leg, Knee pain, Stiffness and inability to fully flex the knee"
Porphyria,"Severe pain in the belly, chest, legs or back., Digestive problems, such as constipation, nausea and vomiting., Muscle pain, tingling, numbness, weakness or paralysis., Red or brown urine., Mental changes, such as anxiety, hallucinations or mental confusion., Rapid or irregular heartbeats you can feel, called palpitations., Breathing problems., High blood pressure., Seizures."
"Post-cardiac injury syndrome, also known asDressler syndrome","Chest pain, Fever"
"Post-chemotherapy cognitive impairment, also known asChemo brain","Being unusually disorganized, Confusion, Difficulty concentrating, Difficulty finding the right word, Difficulty learning new skills, Difficulty multitasking, Feeling of mental fogginess, Short attention span, Short-term memory problems, Taking longer than usual to complete routine tasks, Trouble with verbal memory, such as remembering a conversation, Trouble with visual memory, such as recalling an image or list of words"
"Post-concussion syndrome, also known asPersistent post-concussive symptoms (Post-concussion syndrome)","Headaches., Dizziness., Fatigue., Irritability., Anxiety., Trouble falling asleep or sleeping too much., Loss of concentration and memory., Ringing in the ears., Blurry vision., Noise and light sensitivity., Rarely, decreases in taste and smell."
Posterior cortical atrophy,"Reading, spelling or math., Driving., Getting dressed., Telling the difference between objects that are moving and those that are still., Judging how far away objects are., Using everyday objects or tools., Identifying left from right."
"Posterior prolapse, also known asPosterior vaginal prolapse (rectocele)","A soft bulge of tissue in the vagina that might come through the opening of the vagina, Trouble having a bowel movement, Feeling pressure or fullness in the rectum, A feeling that the rectum has not completely emptied after a bowel movement, Sexual concerns, such as feeling embarrassed or sensing looseness in the tone of the vaginal tissue"
Posterior vaginal prolapse (rectocele),"A soft bulge of tissue in the vagina that might come through the opening of the vagina, Trouble having a bowel movement, Feeling pressure or fullness in the rectum, A feeling that the rectum has not completely emptied after a bowel movement, Sexual concerns, such as feeling embarrassed or sensing looseness in the tone of the vaginal tissue"
Postherpetic neuralgia,"Pain that lasts three months or longer after the shingles rash has healed. The pain may feel burning, sharp and jabbing. Or it may feel deep and aching., Not being able to stand light touch. People with postherpetic neuralgia often can't bear even the touch of clothing on the affected skin., Itching or loss of feeling. Less often, postherpetic neuralgia can cause an itchy feeling or numbness."
"Postmyocardial infarction syndrome, also known asDressler syndrome","Chest pain, Fever"
Postpartum depression,"Mood swings, Anxiety, Sadness, Irritability, Feeling overwhelmed, Crying, Reduced concentration, Appetite problems, Trouble sleeping"
Postpartum preeclampsia,"High blood pressure (hypertension) — 140/90 millimeters of mercury (mm Hg) or greater, Excess protein in your urine (proteinuria), Severe headaches, Changes in vision, including temporary loss of vision, blurred vision or light sensitivity, Pain in your upper belly, usually under the ribs on the right side, Nausea and vomiting, Shortness of breath, Decreased urination"
Post-polio syndrome,"Muscle and joint weakness and pain that gets worse over time, Feeling easily fatigued and exhausted, Losing muscle tissue (atrophy), Breathing or swallowing problems, Sleep-related breathing disorders, such as sleep apnea, Decreased tolerance of cold temperatures"
Post-traumatic stress disorder (PTSD),"Recurrent, unwanted distressing memories of the traumatic event, Reliving the traumatic event as if it were happening again (flashbacks), Upsetting dreams or nightmares about the traumatic event, Severe emotional distress or physical reactions to something that reminds you of the traumatic event"
"Postural hypotension, also known asOrthostatic hypotension (postural hypotension)","Lightheadedness or dizziness upon standing, Blurry vision, Weakness, Fainting (syncope), Confusion"
Post-vasectomy pain syndrome,"Pain and tenderness in the scrotum, Pressure or pain after ejaculation, Dull ache in one or both testicles, Pain and tenderness at the site of the vasectomy, Swelling of the small, C-shaped tube behind the testicle where sperm are stored (epididymis), Pain with sex"
Pouchitis,"Book: Mayo Clinic Family Health Book, 5th Edition, Newsletter: Mayo Clinic Health Letter — Digital Edition"
"Prader-Labhart-Willi syndrome, also known asPrader-Willi syndrome","Poor muscle tone. A primary sign during infancy is poor muscle tone (hypotonia). Babies may rest with their elbows and knees loosely extended instead of fixed, and they may feel floppy or like rag dolls when they're held., Distinct facial features. Children may be born with almond-shaped eyes, a narrowing of the head at the temples, a turned-down mouth and a thin upper lip., Poor sucking reflex. Infants may have a poor sucking reflex due to decreased muscle tone. Poor sucking makes feeding difficult and can result in failure to thrive., Generally poor responsiveness. A baby may seem unusually tired, respond poorly to stimulation, have a hard time waking up or have a weak cry., Underdeveloped genitals. Males may have a small penis and scrotum. The testicles may be small or not descended from the abdomen into the scrotum (cryptorchidism). In females, the clitoris and labia may be small."
Prader-Willi syndrome,"Poor muscle tone. A primary sign during infancy is poor muscle tone (hypotonia). Babies may rest with their elbows and knees loosely extended instead of fixed, and they may feel floppy or like rag dolls when they're held., Distinct facial features. Children may be born with almond-shaped eyes, a narrowing of the head at the temples, a turned-down mouth and a thin upper lip., Poor sucking reflex. Infants may have a poor sucking reflex due to decreased muscle tone. Poor sucking makes feeding difficult and can result in failure to thrive., Generally poor responsiveness. A baby may seem unusually tired, respond poorly to stimulation, have a hard time waking up or have a weak cry., Underdeveloped genitals. Males may have a small penis and scrotum. The testicles may be small or not descended from the abdomen into the scrotum (cryptorchidism). In females, the clitoris and labia may be small."
Precocious puberty,"Breast growth and first period in girls, Enlarged testicles and penis, facial hair and deepening voice in boys, Pubic or underarm hair, Rapid growth, Acne, Adult body odor"
Prediabetes,"Increased thirst, Frequent urination, Increased hunger, Fatigue, Blurred vision, Numbness or tingling in the feet or hands, Frequent infections, Slow-healing sores, Unintended weight loss"
Preeclampsia,"Excess protein in urine (proteinuria) or other signs of kidney problems, Decreased levels of platelets in blood (thrombocytopenia), Increased liver enzymes that indicate liver problems, Severe headaches, Changes in vision, including temporary loss of vision, blurred vision or light sensitivity, Shortness of breath, caused by fluid in the lungs, Pain in the upper belly, usually under the ribs on the right side, Nausea or vomiting"
"Preexcitation syndrome, also known asWolff-Parkinson-White (WPW) syndrome","A rapid, fluttering or pounding heartbeat (palpitations), Chest pain, Difficulty breathing, Dizziness or lightheadedness, Fainting, Fatigue, Shortness of breath, Anxiety"
"Pregnancy-related hypertension, also known asPreeclampsia","Excess protein in urine (proteinuria) or other signs of kidney problems, Decreased levels of platelets in blood (thrombocytopenia), Increased liver enzymes that indicate liver problems, Severe headaches, Changes in vision, including temporary loss of vision, blurred vision or light sensitivity, Shortness of breath, caused by fluid in the lungs, Pain in the upper belly, usually under the ribs on the right side, Nausea or vomiting"
Premature birth,"Small size, with a head that's large compared with the body., Features that are sharper and less rounded than a full-term baby's features due to a lack of cells that store fat., Fine hair that covers much of the body., Low body temperature, mainly right after birth in the delivery room., Trouble breathing., Feeding problems."
Premature ejaculation,"Lifelong. Lifelong premature ejaculation occurs all or nearly all the time beginning with the first sexual encounter., Acquired. Acquired premature ejaculation develops after having previous sexual experiences without problems with ejaculation."
"Premature ovarian failure, also known asPrimary ovarian insufficiency","Irregular or skipped periods, which might be present for years or develop after a pregnancy or after stopping birth control pills, Difficulty getting pregnant, Hot flashes, Night sweats, Vaginal dryness, Dry eyes, Irritability or difficulty concentrating, Decreased sexual desire"
"Premature puberty, also known asPrecocious puberty","Breast growth and first period in girls, Enlarged testicles and penis, facial hair and deepening voice in boys, Pubic or underarm hair, Rapid growth, Acne, Adult body odor"
Premature ventricular contractions (PVCs),"Fluttering, Pounding or jumping, Skipped beats or missed beats, Increased awareness of the heartbeat"
"Premenstrual syndrome, also known asPremenstrual syndrome (PMS)","Tension or anxiety, Depressed mood, Crying spells, Mood swings and irritability or anger, Appetite changes and food cravings, Trouble falling asleep (insomnia), Social withdrawal, Poor concentration, Change in libido"
Premenstrual syndrome (PMS),"Tension or anxiety, Depressed mood, Crying spells, Mood swings and irritability or anger, Appetite changes and food cravings, Trouble falling asleep (insomnia), Social withdrawal, Poor concentration, Change in libido"
"Presbycusis, also known asHearing loss","Muffling of speech and other sounds., Trouble understanding words, especially when in a crowd or a noisy place., Trouble hearing the letters of the alphabet that aren't vowels., Often asking others to speak more slowly, clearly and loudly., Needing to turn up the volume of the television or radio., Staying clear of some social settings., Being bothered by background noise., Ringing in the ears, known as tinnitus."
Presbyopia,"A tendency to hold reading material farther away to make the letters clearer, Blurred vision at normal reading distance, Eyestrain or headaches after reading or doing close-up work"
Prescription drug abuse,"Opioids used to treat pain, such as medicines containing oxycodone (Oxycontin, Percocet) and those containing hydrocodone (Norco), Anti-anxiety medicines, sedatives and hypnotics used to treat anxiety and sleep disorders, such as alprazolam (Xanax), diazepam (Valium) and zolpidem (Ambien), Stimulants used to treat attention-deficit/hyperactivity disorder (ADHD) and certain sleep disorders, such as methylphenidate (Ritalin, Concerta, others), dextroamphetamine-amphetamine (Adderall XR, Mydayis) and dextroamphetamine (Dexedrine)"
"Pressure sore, also known asBedsores (pressure ulcers)","Unusual changes in skin color or texture, Swelling, Pus-like draining, An area of skin that feels cooler or warmer to the touch than other areas, Tender areas"
"Pressure ulcer, also known asBedsores (pressure ulcers)","Unusual changes in skin color or texture, Swelling, Pus-like draining, An area of skin that feels cooler or warmer to the touch than other areas, Tender areas"
Preterm labor,"Regular or frequent sensations of abdominal tightening (contractions), Constant low, dull backache, A sensation of pelvic or lower abdominal pressure, Mild abdominal cramps, Vaginal spotting or light bleeding, Preterm rupture of membranes — in a gush or a continuous trickle of fluid after the membrane around the baby breaks or tears, A change in type of vaginal discharge — watery, mucus-like or bloody"
Priapism,"Erection lasting more than four hours or unrelated to sexual interest or stimulation, Rigid penile shaft, but the tip of penis (glans) is soft, Progressively worsening penile pain"
"Prickly heat, also known asHeat rash","The mildest form of heat rash is called miliaria crystallina. It occurs when the opening of the sweat duct on the surface of the skin (sweat pore) is blocked. This form is marked by tiny, clear, fluid-filled bumps that break easily., A type that occurs deeper in the skin is called miliaria rubra. It is sometimes called prickly heat. Signs and symptoms include small, inflamed blister-like bumps and itching or prickling in the affected area., Occasionally, the inflamed bumps of miliaria rubra fill with pus. This form is called miliaria pustulosa., A less common form of heat rash is called miliaria profunda. It affects the deepest layer of the skin (dermis). It causes firm, painful or itchy inflamed bumps that look like goose bumps and may break open."
"Primary adrenal insufficiency, also known asAddison's disease","Extreme fatigue, Weight loss and loss of appetite, Areas of darkened skin, Low blood pressure, even fainting, Salt craving, Low blood sugar, also called hypoglycemia, Nausea, diarrhea or vomiting, Abdominal pain, Muscle and joint pain, Irritability, Depression, Body hair loss or sexual issues in some people"
Primary biliary cholangitis,"Fatigue, Itchy skin"
"Primary biliary cirrhosis, also known asPrimary biliary cholangitis","Fatigue, Itchy skin"
Primary immunodeficiency,"Frequent and recurrent pneumonia, bronchitis, sinus infections, ear infections, meningitis or skin infections, Inflammation and infection of internal organs, Blood disorders, such as low platelet count or anemia, Digestive problems, such as cramping, loss of appetite, nausea and diarrhea, Delayed growth and development, Autoimmune disorders, such as lupus, rheumatoid arthritis or type 1 diabetes"
Primary lateral sclerosis (PLS),"Stiffness, weakness and muscle spasms (spasticity) in your legs, rarely starting in one leg, and eventually progressing to your arms, hands, tongue and jaw, Slowed movement, Tripping, clumsiness and difficulty with balance, Hand clumsiness, Hoarseness, as well as slowed, slurred speech and drooling, Difficulties with chewing and swallowing, Sometimes, frequent, rapid and intense shifts in emotions (mood lability), Rarely, breathing problems and bladder problems late in the disease"
Primary ovarian insufficiency,"Irregular or skipped periods, which might be present for years or develop after a pregnancy or after stopping birth control pills, Difficulty getting pregnant, Hot flashes, Night sweats, Vaginal dryness, Dry eyes, Irritability or difficulty concentrating, Decreased sexual desire"
"Primary polycythemia, also known asPolycythemia vera","Itchiness, especially after a warm bath or shower, Numbness, tingling, burning, or weakness in your hands, feet, arms or legs, A feeling of fullness soon after eating and bloating or pain in your left upper abdomen due to an enlarged spleen, Unusual bleeding, such as a nosebleed or bleeding gums, Painful swelling of one joint, often the big toe, Shortness of breath and difficulty breathing when lying down"
Primary progressive aphasia,"Trouble understanding spoken or written language, particularly single words., Trouble understanding the meaning of words., Not being able to name objects., Trouble formulating sentences."
Primary sclerosing cholangitis,"Fatigue, Itching, Yellow eyes and skin (jaundice), Abdominal pain"
Proctitis,"A frequent or continuous feeling that you need to have a bowel movement, Rectal bleeding, Passing mucus through your rectum, Rectal pain, Pain on the left side of your abdomen, A feeling of fullness in your rectum, Diarrhea, Pain with bowel movements"
Progeria,"Slowed growth, with below-average height and weight, Narrowed face, small lower jaw, thin lips and beaked nose, Head disproportionately large for the face, Prominent eyes and incomplete closure of the eyelids, Hair loss, including eyelashes and eyebrows, Thinning, spotty, wrinkled skin, Visible veins, High-pitched voice"
Progressive supranuclear palsy,"A loss of balance while walking. A tendency to fall backward can occur very early in the disease., An inability to aim your eyes properly. You may not be able to look downward, or experience blurring and double vision. This difficulty with focusing the eyes can make some people spill food or appear disinterested in conversation because of poor eye contact."
Prolactinoma,"Irregular menstrual periods or no menstrual periods, Milky discharge from the breasts when not pregnant or breastfeeding, Painful intercourse due to vaginal dryness, Acne and excessive body and facial hair growth"
"Prolapse, mitral valve, also known asMitral valve prolapse","A racing or irregular heartbeat (arrhythmia), Dizziness or lightheadedness, Difficulty breathing or shortness of breath, especially during exercise or when lying flat, Fatigue"
