disease,symptoms
"A fib, also known asAtrial fibrillation","Sensations of a fast, fluttering or pounding heartbeat (palpitations), Chest pain, Dizziness, Fatigue, Lightheadedness, Reduced ability to exercise, Shortness of breath, Weakness"
Abdominal aortic aneurysm,"Deep, constant pain in the belly area or side of the belly (abdomen), Back pain, A pulse near the bellybutton"
"Abnormally excessive sweating, also known asHyperhidrosis","Sweating disrupts your daily routine, Sweating causes emotional distress or social withdrawal, You suddenly begin to sweat more than usual, You experience night sweats for no apparent reason"
"Abscess, Bartholin's, also known asBartholin's cyst","A tender, painful lump near the vaginal opening, Discomfort while walking or sitting, Pain during intercourse, Fever"
Absence seizure,"A sudden stop in activity without falling., Lip smacking., Eyelid flutters., Chewing motions., Finger rubbing., Small movements of both hands."
Acanthosis nigricans,"Insulin resistance. Most people who have acanthosis nigricans have also become resistant to insulin. Insulin is a hormone secreted by the pancreas that allows the body to process sugar. Insulin resistance is what leads to type 2 diabetes. Insulin resistance is also related to polycystic ovarian syndrome and might be a factor in why acanthosis nigricans develops., Certain drugs and supplements. High-dose niacin, birth control pills, prednisone and other corticosteroids may cause acanthosis nigricans., Cancer. Some types of cancer cause acanthosis nigricans. These include lymphoma and cancers of the stomach, colon and liver."
Achalasia,"Inability to swallow (dysphagia), which may feel like food or drink is stuck in your throat, Regurgitating food or saliva, Heartburn, Belching, Chest pain that comes and goes, Coughing at night, Pneumonia (from aspiration of food into the lungs), Weight loss, Vomiting"
Achilles tendinitis,"Your sex. Achilles tendinitis occurs most commonly in men., Age. Achilles tendinitis is more common as you age., Physical problems. A naturally flat arch in your foot can put more strain on the Achilles tendon. Obesity and tight calf muscles also can increase tendon strain., Training choices. Running in worn-out shoes can increase your risk of Achilles tendinitis. Tendon pain occurs more frequently in cold weather than in warm weather, and running on hilly terrain also can predispose you to Achilles injury., Medical conditions. People who have psoriasis or high blood pressure are at higher risk of developing Achilles tendinitis., Medications. Certain types of antibiotics, called fluoroquinolones, have been associated with higher rates of Achilles tendinitis."
Achilles tendon rupture,"The feeling of having been kicked in the calf, Pain, possibly severe, and swelling near the heel, An inability to bend the foot downward or ""push off"" the injured leg when walking, An inability to stand on the toes on the injured leg, A popping or snapping sound when the injury occurs"
"Acid reflux, also known asGastroesophageal reflux disease (GERD)","A burning sensation in your chest (heartburn), usually after eating, which might be worse at night or while lying down, Backwash (regurgitation) of food or sour liquid, Upper abdominal or chest pain, Trouble swallowing (dysphagia), Sensation of a lump in your throat"
"Acid reflux, infant, also known asInfant reflux","Isn't gaining weight., Consistently spits up forcefully, causing stomach contents to shoot out of the mouth. This is called projectile vomiting., Spits up green or yellow fluid., Spits up blood or stomach contents that look like coffee grounds., Refuses to feed or eat., Has blood in the stool., Has difficulty breathing or a cough that won't go away., Begins spitting up at age 6 months or older., Is unusually irritable after eating., Doesn't have much energy."
ACL injury,"A loud pop or a ""popping"" sensation in the knee, Severe pain and inability to continue activity, Rapid swelling, Loss of range of motion, A feeling of instability or ""giving way"" with weight bearing"
Acne,"Whiteheads (closed plugged pores), Blackheads (open plugged pores), Small red, tender bumps (papules), Pimples (pustules), which are papules with pus at their tips, Large, solid, painful lumps under the skin (nodules), Painful, pus-filled lumps under the skin (cystic lesions)"
"Acne inversa, also known asHidradenitis suppurativa","Blackheads. Blackheads appear in small pitted areas of skin, often appearing in pairs., Painful pea-sized lumps. The condition usually starts with a single, painful lump under the skin that persists for weeks or months. More bumps may form later, usually in areas where you have more sweat and oil glands or where the skin rubs together, such as the armpits, groin, buttocks and breasts., Leaking bumps or sores. Some bumps or sores get bigger, break open and drain pus with an odor., Tunnels. Over time, tunnels might form under the skin, connecting the lumps. These wounds heal very slowly, if at all, and drain blood and pus."
Acoustic neuroma,"Hearing loss, usually gradually worsening over months to years — although in rare cases sudden — and occurring on only one side or more severe on one side, Ringing (tinnitus) in the affected ear, Unsteadiness or loss of balance, Dizziness (vertigo), Facial numbness and weakness or loss of muscle movement"
"Acquired immunodeficiency syndrome, also known asHIV/AIDS","Fever, Headache, Muscle aches and joint pain, Rash, Sore throat and painful mouth sores, Swollen lymph glands, mainly on the neck, Diarrhea, Weight loss, Cough, Night sweats"
Acromegaly,"Enlarged hands and feet, Enlarged facial features, including the facial bones, lips, nose and tongue, Coarse, oily, thickened skin, Excessive sweating and body odor, Small outgrowths of skin tissue (skin tags), Fatigue and joint or muscle weakness, Pain and limited joint mobility, A deepened, husky voice due to enlarged vocal cords and sinuses, Severe snoring due to obstruction of the upper airway, Vision problems, Headaches, which may be persistent or severe, Menstrual cycle irregularities in women, Erectile dysfunction in men, Loss of interest in sex"
Actinic keratosis,"Rough, dry or scaly patch of skin, usually less than 1 inch (2.5 centimeters) in diameter, Flat to slightly raised patch or bump on the top layer of skin, In some cases, a hard, wartlike surface, Color variations, including pink, red or brown, Itching, burning, bleeding or crusting, New patches or bumps on sun-exposed areas of the head, neck, hands and forearms"
Acute coronary syndrome,"Chest pain (angina) or discomfort, often described as aching, pressure, tightness or burning, Pain spreading from the chest to the shoulders, arms, upper abdomen, back, neck or jaw, Nausea or vomiting, Indigestion, Shortness of breath (dyspnea), Sudden, heavy sweating (diaphoresis), Lightheadedness, dizziness or fainting, Unusual or unexplained fatigue, Feeling restless or apprehensive"
Acute flaccid myelitis (AFM),"Sudden arm or leg weakness, Sudden loss of muscle tone, Sudden loss of reflexes"
"Acute granulocytic leukemia, also known asAcute myelogenous leukemia","Fever, Bone pain, Lethargy and fatigue, Shortness of breath, Pale skin, Frequent infections, Easy bruising, Unusual bleeding, such as frequent nosebleeds and bleeding from the gums"
"Acute inflammatory demyelinating polyneuropathy, also known asGuillain-Barre syndrome","A pins and needles sensation in your fingers, toes, ankles or wrists, Weakness in your legs that spreads to your upper body, Unsteady walking or inability to walk or climb stairs, Difficulty with facial movements, including speaking, chewing or swallowing, Double vision or inability to move the eyes, Severe pain that may feel achy, shooting or cramplike and may be worse at night, Difficulty with bladder control or bowel function, Rapid heart rate, Low or high blood pressure, Difficulty breathing"
Acute kidney failure,"Decreased urine output, although occasionally urine output remains normal, Fluid retention, causing swelling in your legs, ankles or feet, Shortness of breath, Fatigue, Confusion, Nausea, Weakness, Irregular heartbeat, Chest pain or pressure, Seizures or coma in severe cases"
Acute liver failure,"Yellowing of your skin and eyeballs (jaundice), Pain in your upper right abdomen, A swollen belly (ascites), Nausea, Vomiting, A general sense of feeling unwell (malaise), Disorientation or confusion, Sleepiness, Breath may have a musty or sweet odor, Tremors"
"Acute lymphoblastic leukemia, also known asAcute lymphocytic leukemia","Bleeding from the gums, Bone pain, Fever, Frequent infections, Frequent or severe nosebleeds, Lumps caused by swollen lymph nodes in and around the neck, armpits, abdomen or groin, Pale skin, Shortness of breath, Weakness, fatigue or a general decrease in energy"
Acute lymphocytic leukemia,"Bleeding from the gums, Bone pain, Fever, Frequent infections, Frequent or severe nosebleeds, Lumps caused by swollen lymph nodes in and around the neck, armpits, abdomen or groin, Pale skin, Shortness of breath, Weakness, fatigue or a general decrease in energy"
"Acute lymphoid leukemia, also known asAcute lymphocytic leukemia","Bleeding from the gums, Bone pain, Fever, Frequent infections, Frequent or severe nosebleeds, Lumps caused by swollen lymph nodes in and around the neck, armpits, abdomen or groin, Pale skin, Shortness of breath, Weakness, fatigue or a general decrease in energy"
"Acute myeloblastic leukemia, also known asAcute myelogenous leukemia","Fever, Bone pain, Lethargy and fatigue, Shortness of breath, Pale skin, Frequent infections, Easy bruising, Unusual bleeding, such as frequent nosebleeds and bleeding from the gums"
Acute myelogenous leukemia,"Fever, Bone pain, Lethargy and fatigue, Shortness of breath, Pale skin, Frequent infections, Easy bruising, Unusual bleeding, such as frequent nosebleeds and bleeding from the gums"
"Acute myeloid lukemia, also known asAcute myelogenous leukemia","Fever, Bone pain, Lethargy and fatigue, Shortness of breath, Pale skin, Frequent infections, Easy bruising, Unusual bleeding, such as frequent nosebleeds and bleeding from the gums"
"Acute nonlymphocytic leukemia, also known asAcute myelogenous leukemia","Fever, Bone pain, Lethargy and fatigue, Shortness of breath, Pale skin, Frequent infections, Easy bruising, Unusual bleeding, such as frequent nosebleeds and bleeding from the gums"
"Acute radiation sickness, also known asRadiation sickness","Nausea and vomiting, Diarrhea, Headache, Fever, Dizziness and disorientation, Weakness and fatigue, Hair loss, Bloody vomit and stools from internal bleeding, Infections, Low blood pressure"
"Acute radiation syndrome, also known asRadiation sickness","Nausea and vomiting, Diarrhea, Headache, Fever, Dizziness and disorientation, Weakness and fatigue, Hair loss, Bloody vomit and stools from internal bleeding, Infections, Low blood pressure"
"Acute renal failure, also known asAcute kidney failure","Decreased urine output, although occasionally urine output remains normal, Fluid retention, causing swelling in your legs, ankles or feet, Shortness of breath, Fatigue, Confusion, Nausea, Weakness, Irregular heartbeat, Chest pain or pressure, Seizures or coma in severe cases"
"Acute respiratory distress syndrome, also known asARDS","Severe shortness of breath, Labored and unusually rapid breathing, Low blood pressure, Confusion and extreme tiredness"
Acute sinusitis,"Thick, yellow or greenish mucus from the nose (runny nose) or down the back of the throat (postnasal drainage), Blocked or stuffy nose (congestion) causing difficulty breathing through your nose, Pain, tenderness, swelling and pressure around your eyes, cheeks, nose or forehead that worsens when bending over"
"Addiction, alcohol, also known asAlcohol use disorder","Being unable to limit the amount of alcohol you drink, Wanting to cut down on how much you drink or making unsuccessful attempts to do so, Spending a lot of time drinking, getting alcohol or recovering from alcohol use, Feeling a strong craving or urge to drink alcohol, Failing to fulfill major obligations at work, school or home due to repeated alcohol use, Continuing to drink alcohol even though you know it's causing physical, social, work or relationship problems, Giving up or reducing social and work activities and hobbies to use alcohol, Using alcohol in situations where it's not safe, such as when driving or swimming, Developing a tolerance to alcohol so you need more to feel its effect or you have a reduced effect from the same amount, Experiencing withdrawal symptoms — such as nausea, sweating and shaking — when you don't drink, or drinking to avoid these symptoms"
"Addiction, gambling, also known asCompulsive gambling","Being preoccupied with gambling, such as constantly planning gambling activities and how to get more gambling money, Needing to gamble with increasing amounts of money to get the same thrill, Trying to control, cut back or stop gambling, without success, Feeling restless or irritable when you try to cut down on gambling, Gambling to escape problems or relieve feelings of helplessness, guilt, anxiety or depression, Trying to get back lost money by gambling more (chasing losses), Lying to family members or others to hide the extent of your gambling, Risking or losing important relationships, a job, or school or work opportunities because of gambling, Asking others to bail you out of financial trouble because you gambled money away"
"Addiction, nicotine, also known asNicotine dependence","You can't stop smoking. You've made one or more serious, but unsuccessful, attempts to stop., You have withdrawal symptoms when you try to stop. Your attempts at stopping have caused physical and mood-related symptoms, such as strong cravings, anxiety, irritability, restlessness, difficulty concentrating, depressed mood, frustration, anger, increased hunger, insomnia, constipation or diarrhea., You keep smoking despite health problems. Even though you've developed health problems with your lungs or your heart, you haven't been able to stop., You give up social activities. You may stop going to smoke-free restaurants or stop socializing with family or friends because you can't smoke in these situations."
Addison's disease,"Extreme fatigue, Weight loss and loss of appetite, Areas of darkened skin, Low blood pressure, even fainting, Salt craving, Low blood sugar, also called hypoglycemia, Nausea, diarrhea or vomiting, Abdominal pain, Muscle and joint pain, Irritability, Depression, Body hair loss or sexual issues in some people"
"Adenitis, mesenteric, also known asMesenteric lymphadenitis","Abdominal pain, often centered on the lower right side, but the pain can be more widespread, General abdominal tenderness, Fever, Mesenteric lymph node enlargement"
Adenomyosis,"Heavy or prolonged menstrual bleeding, Severe cramping or sharp, knifelike pelvic pain during menstruation (dysmenorrhea), Chronic pelvic pain, Painful intercourse (dyspareunia)"
"ADHD in children, also known asAttention-deficit/hyperactivity disorder (ADHD) in children","Predominantly inattentive. The majority of symptoms fall under inattention., Predominantly hyperactive/impulsive. The majority of symptoms are hyperactive and impulsive., Combined. This is a mix of inattentive symptoms and hyperactive/impulsive symptoms."
"ADHD, Adult, also known asAdult attention-deficit/hyperactivity disorder (ADHD)","Impulsiveness, Disorganization and problems prioritizing, Poor time management skills, Problems focusing on a task, Trouble multitasking, Excessive activity or restlessness, Poor planning, Low frustration tolerance, Frequent mood swings, Problems following through and completing tasks, Hot temper, Trouble coping with stress"
"Adhesive capsulitis, also known asFrozen shoulder","Freezing stage. Any movement of the shoulder causes pain, and the shoulder's ability to move becomes limited. This stage lasts from 2 to 9 months., Frozen stage. Pain might lessen during this stage. However, the shoulder becomes stiffer. Using it becomes more difficult. This stage lasts from 4 to 12 months., Thawing stage. The shoulder's ability to move begins to improve. This stage lasts from 5 to 24 months."
Adjustment disorders,"Feeling sad, hopeless or not enjoying things you used to enjoy, Frequent crying, Worrying or feeling anxious, nervous, jittery or stressed out, Trouble sleeping, Lack of appetite, Difficulty concentrating, Feeling overwhelmed, Difficulty functioning in daily activities, Withdrawing from social supports, Avoiding important things such as going to work or paying bills, Suicidal thoughts or behavior"
"Adolescent schizophrenia, also known asChildhood schizophrenia","Problems with thinking and reasoning, Bizarre ideas or speech, Confusing dreams or television for reality"
Adrenal cancer,"Weight gain, Muscle weakness, Pink or purple stretch marks on the skin, Hormone changes in women that might cause excess facial hair, hair loss on the head and irregular periods, Hormone changes in men that might cause enlarged breast tissue and shrinking testicles, Nausea, Vomiting, Abdominal bloating, Back pain, Fever, Loss of appetite, Loss of weight without trying"
Adult attention-deficit/hyperactivity disorder (ADHD),"Impulsiveness, Disorganization and problems prioritizing, Poor time management skills, Problems focusing on a task, Trouble multitasking, Excessive activity or restlessness, Poor planning, Low frustration tolerance, Frequent mood swings, Problems following through and completing tasks, Hot temper, Trouble coping with stress"
Adult Still's disease,"Fever. You might have a daily fever of at least 102 F (38.9 C) for a week or longer. The fever usually peaks in the late afternoon or early evening. You might have two fever spikes daily, with your temperature returning to normal in between., Rash. A salmon-pink rash might come and go with the fever. The rash usually appears on your trunk, arms or legs., Sore throat. This is one of the first symptoms of adult Still's disease. The lymph nodes in your neck might be swollen and tender., Achy and swollen joints. Your joints — especially your knees and wrists — might be stiff, painful and inflamed. Ankles, elbows, hands and shoulders might also ache. The joint discomfort usually lasts at least two weeks., Muscle pain. Muscular pain usually ebbs and flows with the fever, but the pain can be severe enough to disrupt your daily activities."
"AFM, also known asAcute flaccid myelitis (AFM)","Sudden arm or leg weakness, Sudden loss of muscle tone, Sudden loss of reflexes"
Age spots (liver spots),"Are flat, oval areas of increased pigmentation, Are usually tan to dark brown, Occur on skin that has had the most sun exposure over the years, such as the backs of hands, tops of feet, face, shoulders and upper back, Range from freckle size to about 1/2 inch (13 millimeters) across, Can group together, making them more noticeable"
"Age-related macular degeneration, dry, also known asDry macular degeneration","Visual distortions, such as straight lines seeming bent., Reduced central vision in one or both eyes., The need for brighter light when reading or doing close-up work., Increased difficulty adapting to low light levels, such as when entering a dimly lit restaurant or theater., Increased blurriness of printed words., Difficulty recognizing faces., A well-defined blurry spot or blind spot in the field of vision."
"Age-related macular degeneration, wet, also known asWet macular degeneration","Visual distortions, such as straight lines seeming bent., Reduced central vision in one or both eyes., The need for brighter light when reading or doing close-up work., Difficulty adjusting to low light levels, such as when entering a dimly lit restaurant or theater., Increased blurriness of printed words., Difficulty recognizing faces., A well-defined blurry spot or blind spot in the field of vision."
"Agnogenic myeloid metaplasia, also known asMyelofibrosis","Feeling tired, weak or short of breath, usually because of anemia, Pain or fullness below your ribs on the left side, due to an enlarged spleen, Easy bruising, Easy bleeding, Excessive sweating during sleep (night sweats), Fever, Bone pain"
Agoraphobia,"Leaving home alone., Crowds or waiting in line., Enclosed spaces, such as movie theaters, elevators or small stores., Open spaces, such as parking lots, bridges or malls., Using public transportation, such as a bus, plane or train."
"AIDP, also known asGuillain-Barre syndrome","A pins and needles sensation in your fingers, toes, ankles or wrists, Weakness in your legs that spreads to your upper body, Unsteady walking or inability to walk or climb stairs, Difficulty with facial movements, including speaking, chewing or swallowing, Double vision or inability to move the eyes, Severe pain that may feel achy, shooting or cramplike and may be worse at night, Difficulty with bladder control or bowel function, Rapid heart rate, Low or high blood pressure, Difficulty breathing"
"AIDS/HIV, also known asHIV/AIDS","Fever, Headache, Muscle aches and joint pain, Rash, Sore throat and painful mouth sores, Swollen lymph glands, mainly on the neck, Diarrhea, Weight loss, Cough, Night sweats"
Airplane ear,"Moderate discomfort or pain in your ear, Feeling of fullness or stuffiness in your ear, Muffled hearing or slight to moderate hearing loss"
Albinism,"Freckles., Moles, with or without color, which are sometimes pink., Large freckle-like spots, called solar lentigines (len-TIJ-ih-neez)., Sunburn and no ability to tan."
"Alcohol addiction, also known asAlcohol use disorder","Being unable to limit the amount of alcohol you drink, Wanting to cut down on how much you drink or making unsuccessful attempts to do so, Spending a lot of time drinking, getting alcohol or recovering from alcohol use, Feeling a strong craving or urge to drink alcohol, Failing to fulfill major obligations at work, school or home due to repeated alcohol use, Continuing to drink alcohol even though you know it's causing physical, social, work or relationship problems, Giving up or reducing social and work activities and hobbies to use alcohol, Using alcohol in situations where it's not safe, such as when driving or swimming, Developing a tolerance to alcohol so you need more to feel its effect or you have a reduced effect from the same amount, Experiencing withdrawal symptoms — such as nausea, sweating and shaking — when you don't drink, or drinking to avoid these symptoms"
Alcohol intolerance,"Facial redness (flushing), Red, itchy skin bumps (hives), Worsening of pre-existing asthma, Runny or stuffy nose, Low blood pressure, Nausea and vomiting, Diarrhea"
Alcohol poisoning,"Confusion, Vomiting, Seizures, Slow breathing (less than eight breaths a minute), Irregular breathing (a gap of more than 10 seconds between breaths), Blue-tinged skin or pale skin, Low body temperature (hypothermia), Passing out (unconsciousness) and can't be awakened"
Alcohol use disorder,"Being unable to limit the amount of alcohol you drink, Wanting to cut down on how much you drink or making unsuccessful attempts to do so, Spending a lot of time drinking, getting alcohol or recovering from alcohol use, Feeling a strong craving or urge to drink alcohol, Failing to fulfill major obligations at work, school or home due to repeated alcohol use, Continuing to drink alcohol even though you know it's causing physical, social, work or relationship problems, Giving up or reducing social and work activities and hobbies to use alcohol, Using alcohol in situations where it's not safe, such as when driving or swimming, Developing a tolerance to alcohol so you need more to feel its effect or you have a reduced effect from the same amount, Experiencing withdrawal symptoms — such as nausea, sweating and shaking — when you don't drink, or drinking to avoid these symptoms"
Alcoholic hepatitis,"Loss of appetite, Nausea and vomiting, Abdominal tenderness, Fever, often low grade, Fatigue and weakness"
"Allergic granulomatosis, also known asChurg-Strauss syndrome","Loss of appetite and weight loss, Joint and muscle pain, Abdominal pain and gastrointestinal bleeding, Weakness, fatigue or a general feeling of being unwell, Rash or skin sores, Pain, numbness, and tingling in your hands and feet"
"Allergic granulomatosis and angiitis, also known asChurg-Strauss syndrome","Loss of appetite and weight loss, Joint and muscle pain, Abdominal pain and gastrointestinal bleeding, Weakness, fatigue or a general feeling of being unwell, Rash or skin sores, Pain, numbness, and tingling in your hands and feet"
"Allergic rhinitis, also known asHay fever","Runny nose and nasal stuffiness (congestion), Watery, itchy, red eyes (allergic conjunctivitis), Sneezing, Cough, Itchy nose, roof of mouth or throat, Mucus that runs down the back of your throat (postnasal drip), Swollen, bruised-appearing skin under the eyes (allergic shiners), Extreme tiredness (fatigue), often due to poor sleep"
Allergies,"Sneezing, Itching of the nose, eyes or roof of the mouth, Runny, stuffy nose, Watery, red or swollen eyes (conjunctivitis)"
"Allergy, dust mite, also known asDust mite allergy","Sneezing, Runny nose, Itchy, red or watery eyes, Nasal congestion, Itchy nose, roof of mouth or throat, Postnasal drip, Cough, Facial pressure and pain, Swollen, blue-colored skin under your eyes, In a child, frequent upward rubbing of the nose"
"Allergy, food, also known asFood allergy","Tingling or itching in the mouth, Hives, itching or eczema, Swelling of the lips, face, tongue and throat or other parts of the body, Wheezing, nasal congestion or trouble breathing, Abdominal pain, diarrhea, nausea or vomiting, Dizziness, lightheadedness or fainting"
"Allergy, latex, also known asLatex allergy","Itching, Skin redness, Hives or rash"
