disease,symptoms
Conjoined twins,"Chest. Thoracopagus (thor-uh-KOP-uh-gus) twins are joined face to face at the chest. They often have a shared heart and may also share one liver and upper intestine. This is one of the most common sites of conjoined twins., Abdomen. Omphalopagus (om-fuh-LOP-uh-gus) twins are joined near the bellybutton. Many omphalopagus twins share the liver and some part of the upper digestive (gastrointestinal or GI) tract. Some twins share the lower part of the small intestine (ileum) and the longest part of the large intestine (colon). They generally do not share a heart., Base of spine. Pygopagus (pie-GOP-uh-gus) twins are commonly joined back to back at the base of the spine and the buttocks. Some pygopagus twins share the lower gastrointestinal (GI) tract. A few twins share the genital and urinary organs., Length of spine. Rachipagus (ray-KIP-uh-gus), also called rachiopagus (ray-kee-OP-uh-gus), twins are joined back to back along the length of the spine. This type is very rare., Pelvis. Ischiopagus (is-kee-OP-uh-gus) twins are joined at the pelvis, either face to face or end to end. Many ischiopagus twins share the lower GI tract, as well as the liver and genital and urinary tract organs. Each twin may have two legs or, less commonly, the twins share two or three legs., Trunk. Parapagus (pa-RAP-uh-gus) twins are joined side to side at the pelvis and part or all of the belly (abdomen) and chest, but with separate heads. The twins can have two, three or four arms and two or three legs., Head. Craniopagus (kray-nee-OP-uh-gus) twins are joined at the back, top or side of the head, but not the face. Craniopagus twins share a portion of the skull. But their brains are usually separate, though they may share some brain tissue., Head and chest. Cephalopagus (sef-uh-LOP-uh-gus) twins are joined at the head and upper body. The faces are on opposite sides of a single shared head, and they share a brain. These twins rarely survive."
"Conjunctivitis, also known asPink eye (conjunctivitis)","Redness in one or both eyes., Itchiness in one or both eyes., A gritty feeling in one or both eyes., A discharge in one or both eyes that forms a crust during the night that may prevent your eye or eyes from opening in the morning., Tearing., Sensitivity to light, called photophobia."
Constipation,"Passing fewer than three stools a week, Having lumpy or hard stools, Straining to have bowel movements, Feeling as though there's a blockage in your rectum that prevents bowel movements, Feeling as though you can't completely empty the stool from your rectum, Needing help to empty your rectum, such as using your hands to press on your abdomen and using a finger to remove stool from your rectum"
Constipation in children,"Less than three bowel movements a week, Bowel movements that are hard, dry and difficult to pass, Pain while having a bowel movement, Stomach pain, Traces of liquid or pasty stool in your child's underwear — a sign that stool is backed up in the rectum, Blood on the surface of hard stool"
Contact dermatitis,"An itchy rash, Leathery patches that are darker than usual (hyperpigmented), typically on brown or Black skin, Dry, cracked, scaly skin, typically on white skin, Bumps and blisters, sometimes with oozing and crusting, Swelling, burning or tenderness"
"Conversion disorder, also known asFunctional neurologic disorder/conversion disorder","Weakness or paralysis, Abnormal movement, such as tremors or difficulty walking, Loss of balance, Difficulty swallowing or feeling ""a lump in the throat"", Seizures or episodes of shaking and apparent loss of consciousness (nonepileptic seizures), Episodes of unresponsiveness"
"Cooley's anemia, also known asThalassemia","Fatigue, Weakness, Pale or yellowish skin, Facial bone deformities, Slow growth, Abdominal swelling, Dark urine"
COPD,"Shortness of breath, especially during physical activities, Wheezing, Chest tightness, A chronic cough that may produce mucus (sputum) that may be clear, white, yellow or greenish, Frequent respiratory infections, Lack of energy, Unintended weight loss (in later stages), Swelling in ankles, feet or legs"
Corns and calluses,"A thick, rough area of skin, A hardened, raised bump, Tenderness or pain under the skin, Flaky, dry or waxy skin"
Coronary artery disease,"Chest pain (angina). You may feel pressure or tightness in your chest. Some people say it feels like someone is standing on their chest. The chest pain usually occurs on the middle or left side of the chest. Activity or strong emotions can trigger angina. The pain usually goes away within minutes after the triggering event ends. In some people, especially women, the pain may be brief or sharp and felt in the neck, arm or back., Shortness of breath. You may feel like you can't catch your breath., Fatigue. If the heart can't pump enough blood to meet your body's needs, you may feel unusually tired., Heart attack. A completely blocked coronary artery will cause a heart attack. The classic signs and symptoms of a heart attack include crushing chest pain or pressure, shoulder or arm pain, shortness of breath, and sweating. Women may have less typical symptoms, such as neck or jaw pain, nausea and fatigue. Some heart attacks don't cause any noticeable signs or symptoms."
"Coronary microvascular disease, also known asSmall vessel disease","Chest pain, squeezing or discomfort (angina), which may get worse with activity or emotional stress, Discomfort in the left arm, jaw, neck, back or abdomen along with chest pain, Shortness of breath, Tiredness and lack of energy"
Coronavirus disease 2019 (COVID-19),"Fever, Cough, Tiredness"
Corticobasal degeneration (corticobasal syndrome),"Difficulty moving on one or both sides of the body, which gets worse over time, Poor coordination, Trouble with balance, Stiffness, Abnormal postures of the hands or feet, such as a hand forming a clenched fist, Muscle jerks, Difficulty swallowing, Abnormal eye movements, Trouble with thinking and language skills, Speech problems, such as slow and halting speech, Difficulty swallowing"
Costochondritis,"Occurs on the left side of your breastbone, Is sharp, aching or pressure-like, Affects more than one rib, Can radiate to arms and shoulders, Worsens when taking a deep breath, coughing, sneezing or with any chest wall movement"
"Costosternal chondrodynia, also known asCostochondritis","Occurs on the left side of your breastbone, Is sharp, aching or pressure-like, Affects more than one rib, Can radiate to arms and shoulders, Worsens when taking a deep breath, coughing, sneezing or with any chest wall movement"
"Costosternal syndrome, also known asCostochondritis","Occurs on the left side of your breastbone, Is sharp, aching or pressure-like, Affects more than one rib, Can radiate to arms and shoulders, Worsens when taking a deep breath, coughing, sneezing or with any chest wall movement"
Cough headaches,"Begin suddenly with and just after coughing or other types of straining, Typically last a few seconds to a few minutes — some can last up to two hours, Cause sharp, stabbing, splitting or ""bursting"" pain, Usually affect both sides of your head and may be worse in the back of your head, May be followed by a dull, aching pain for hours"
"Cough, chronic, also known asChronic cough","A runny or stuffy nose, A feeling of liquid running down the back of your throat (postnasal drip), Frequent throat clearing and sore throat, Hoarseness, Wheezing and shortness of breath, Heartburn or a sour taste in your mouth, In rare cases, coughing up blood"
"COVID-19, also known asCoronavirus disease 2019 (COVID-19)","Fever, Cough, Tiredness"
"COVID-19-associated multisystem inflammatory syndrome in children, also known asMultisystem inflammatory syndrome in children (MIS-C)","Either had COVID-19 or has a close contact who had COVID-19 in the 2 months before hospitalization., Has a fever., Has a blood test result that shows a high level of inflammation throughout the body, called systemic inflammation., Has at least two of the following symptoms:, Heart problems., Red, bloodshot eyes., Redness or swelling of the lips and tongue., Redness or swelling of the hands or feet., Pain in the belly, vomiting or diarrhea., Problems with blood clotting., Shock."
Cradle cap,"Patchy scaling or thick crusts on the scalp, Oily or dry skin covered with flaky white or yellow scales, Skin flakes, Possibly mild redness"
"Cramp, muscle, also known asMuscle cramp","Cause severe discomfort., Have leg swelling, redness or skin changes., Come with muscle weakness., Happen often., Don't get better with self-care."
"Cramps, menstrual, also known asMenstrual cramps","Throbbing or cramping pain in your lower abdomen that can be intense, Pain that starts 1 to 3 days before your period, peaks 24 hours after the onset of your period and subsides in 2 to 3 days, Dull, continuous ache, Pain that radiates to your lower back and thighs"
"Cranial arteritis, also known asGiant cell arteritis","Persistent, severe head pain, usually in your temple area, Scalp tenderness, Jaw pain when you chew or open your mouth wide, Fever, Fatigue, Unintended weight loss, Vision loss or double vision, particularly in people who also have jaw pain, Sudden, permanent loss of vision in one eye"
Craniosynostosis,"A misshapen skull, with the shape depending on which of the sutures are affected, Development of a raised, hard ridge along affected sutures, with a change in the shape of the head that's not typical"
Creutzfeldt-Jakob disease,"Personality changes., Memory loss., Impaired thinking., Blurry vision or blindness., Insomnia., Problems with coordination., Trouble speaking., Trouble swallowing., Sudden, jerky movements."
Crohn's disease,"Diarrhea, Fever, Fatigue, Abdominal pain and cramping, Blood in your stool, Mouth sores, Reduced appetite and weight loss, Pain or drainage near or around the anus due to inflammation from a tunnel into the skin (fistula)"
Croup,"Loud barking cough that's made worse by crying and coughing, as well as anxiety and distress, setting up a cycle of worsening symptoms., Fever., Hoarse voice., Noisy or labored breathing."
"CRPS, also known asComplex regional pain syndrome","Continuous burning or throbbing pain, usually in the arm, leg, hand or foot, Sensitivity to touch or cold, Swelling of the painful area, Changes in skin temperature — alternating between sweaty and cold, Changes in skin color, ranging from white and blotchy to red or blue, Changes in skin texture, which may become tender, thin or shiny in the affected area, Changes in hair and nail growth, Joint stiffness, swelling and damage, Muscle spasms, tremors and weakness (atrophy), Decreased ability to move the affected body part"
Cryoglobulinemia,"Skin lesions. Most people with cryoglobulinemia develop purplish skin lesions on their legs. In some people, leg ulcers also occur., Joint pain. Symptoms resembling rheumatoid arthritis are common in cryoglobulinemia., Peripheral neuropathy. Cryoglobulinemia can damage the nerves at the tips of your fingers and toes, causing numbness and other problems."
"Cryptorchidism, also known asUndescended testicle","A retractile testicle, which moves back and forth between the scrotum and the groin and might be easily guided by hand into the scrotum during a physical exam. This is not abnormal and is due to a muscle reflex in the scrotum., An ascending testicle, or acquired undescended testicle, that has ""returned"" to the groin and can't be easily guided by hand into the scrotum."
CSF leak (Cerebrospinal fluid leak),"Cause pain in the back of the head, Improve when lying down, Worsen when standing up, May start or worsen with exertion (such as coughing or straining), Rarely, start suddenly (""thunderclap"" headache)"
"CTCL, also known asCutaneous T-cell lymphoma","Round patches of skin that may be raised or scaly and might be itchy, Patches of skin that appear lighter in color than surrounding skin, Lumps that form on the skin and may break open, Enlarged lymph nodes, Hair loss, Thickening of the skin on the palms of the hands and soles of the feet, A rash-like skin redness over the entire body that is intensely itchy"
"Curvature of the penis, also known asPeyronie's disease","Scar tissue. The scar tissue associated with Peyronie's disease — called plaque but different from plaque that can build up in blood vessels — can be felt under the skin of the penis as flat lumps or a band of hard tissue., A significant bend to the penis. Your penis might curve upward or downward or bend to one side., Erection problems. Peyronie's disease might cause problems getting or maintaining an erection (erectile dysfunction). But, often men report erectile dysfunction before the beginning of Peyronie's disease symptoms., Shortening of the penis. Your penis might become shorter as a result of Peyronie's disease., Pain. You might have penile pain, with or without an erection., Other penile deformity. In some men with Peyronie's disease, the erect penis might have narrowing, indentations or even an hourglass-like appearance, with a tight, narrow band around the shaft."
"Curvature of the spine, also known asScoliosis","Uneven shoulders, One shoulder blade that appears more prominent than the other, Uneven waist, One hip higher than the other, One side of the rib cage jutting forward, A prominence on one side of the back when bending forward"
Cushing syndrome,"Weight gain and fatty tissue deposits, particularly around the midsection and upper back, in the face (moon face), and between the shoulders (buffalo hump), Pink or purple stretch marks (striae) on the skin of the abdomen, thighs, breasts and arms, Thinning, fragile skin that bruises easily, Slow healing of cuts, insect bites and infections, Acne"
Cutaneous T-cell lymphoma,"Round patches of skin that may be raised or scaly and might be itchy, Patches of skin that appear lighter in color than surrounding skin, Lumps that form on the skin and may break open, Enlarged lymph nodes, Hair loss, Thickening of the skin on the palms of the hands and soles of the feet, A rash-like skin redness over the entire body that is intensely itchy"
"Cutting/self-injury, also known asSelf-injury/cutting","Scars, often in patterns., Fresh cuts, scratches, bruises, bite marks or other wounds., Excessive rubbing of an area to create a burn., Keeping sharp objects or other items used for self-injury on hand., Wearing long sleeves or long pants to hide self-injury, even in hot weather., Frequent reports of accidental injury., Difficulties in relationships with others., Behaviors and emotions that change quickly and are impulsive, intense and unexpected., Talk of helplessness, hopelessness or worthlessness."
"CVA, also known asStroke","Trouble speaking and understanding what others are saying. You may experience confusion, slur words or have difficulty understanding speech., Paralysis or numbness of the face, arm or leg. You may develop sudden numbness, weakness or paralysis in the face, arm or leg. This often affects just one side of the body. Try to raise both your arms over your head at the same time. If one arm begins to fall, you may be having a stroke. Also, one side of your mouth may droop when you try to smile., Problems seeing in one or both eyes. You may suddenly have blurred or blackened vision in one or both eyes, or you may see double., Headache. A sudden, severe headache, which may be accompanied by vomiting, dizziness or altered consciousness, may indicate that you're having a stroke., Trouble walking. You may stumble or lose your balance. You may also have sudden dizziness or a loss of coordination."
Cyclic vomiting syndrome,"Three or more recurrent episodes of vomiting that start around the same time and last for a similar length of time, Varying intervals of generally normal health without nausea between episodes, Intense nausea and sweating before an episode starts"
Cyclothymia (cyclothymic disorder),"An exaggerated feeling of happiness or well-being (euphoria), Extreme optimism, Inflated self-esteem, Talking more than usual, Poor judgment that can result in risky behavior or unwise choices, Racing thoughts, Irritable or agitated behavior, Excessive physical activity, Increased drive to perform or achieve goals (sexual, work related or social), Decreased need for sleep, Tendency to be easily distracted, Inability to concentrate"
"Cyclothymic disorder, also known asCyclothymia (cyclothymic disorder)","An exaggerated feeling of happiness or well-being (euphoria), Extreme optimism, Inflated self-esteem, Talking more than usual, Poor judgment that can result in risky behavior or unwise choices, Racing thoughts, Irritable or agitated behavior, Excessive physical activity, Increased drive to perform or achieve goals (sexual, work related or social), Decreased need for sleep, Tendency to be easily distracted, Inability to concentrate"
"Cyst, Bartholin's, also known asBartholin's cyst","A tender, painful lump near the vaginal opening, Discomfort while walking or sitting, Pain during intercourse, Fever"
"Cyst, ganglion, also known asGanglion cyst","Location. Ganglion cysts most often develop along the tendons or joints of wrists or hands. The next most common locations are the ankles and feet. These cysts grow near other joints too., Shape and size. Ganglion cysts are round or oval. Some are too small to feel. The size of a cyst can change, often getting larger over time with joint movement., Pain. Ganglion cysts usually are painless. But if a cyst presses on a nerve or other structures, it can cause pain, tingling, numbness or muscle weakness."
"Cyst, kidney, also known asKidney cysts","Dull pain in the back or side, Fever, Upper stomach pain"
"Cyst, ovarian, also known asOvarian cysts","Pelvic pain that may come and go. You may feel a dull ache or a sharp pain in the area below your bellybutton toward one side., Fullness, pressure or heaviness in your belly (abdomen)., Bloating."
"Cyst, pancreatic, also known asPancreatic cysts","Persistent abdominal pain, which may radiate to your back, Nausea and vomiting, Weight loss, Feeling full soon after you start eating"
"Cyst, pilonidal, also known asPilonidal cyst","A pit near the top of the buttocks crease., Pain., Inflamed, swollen skin., Pus or blood leaking from an opening in the skin., An odor from draining pus."
"Cyst, spermatic, also known asSpermatocele","Pain or discomfort in the affected testicle, Heaviness in the testicle with the spermatocele, Fullness behind and above the testicle"
Cystic fibrosis,"A persistent cough that produces thick mucus (sputum), Wheezing, Exercise intolerance, Repeated lung infections, Inflamed nasal passages or a stuffy nose, Recurrent sinusitis"
Cystitis,"A strong, persistent urge to urinate, Pain or a burning feeling when urinating, Passing frequent, small amounts of urine, Blood in the urine (hematuria), Passing cloudy or strong-smelling urine, Pelvic discomfort, A feeling of pressure in the area below your belly button (abdomen), Low-grade fever"
"Cystitis, interstitial, also known asInterstitial cystitis","Pain in your pelvis or between the vagina and anus in women, Pain between the scrotum and anus (perineum) in men, Chronic pelvic pain, A persistent, urgent need to urinate, Frequent urination, often of small amounts, throughout the day and night (up to 60 times a day), Pain or discomfort while the bladder fills and relief after urinating, Pain during sex"
"Cystocele, also known asAnterior vaginal prolapse (cystocele)","A feeling of fullness or pressure in your pelvis and vagina, In some cases, a bulge of tissue in your vagina that you can see or feel, Increased pelvic pressure when you strain, cough, bear down or lift, Problems urinating, including difficulty starting a urine stream, the feeling that you haven't completely emptied your bladder after urinating, feeling a frequent need to urinate or leaking urine (urinary incontinence)"
"Cysts, epidermoid, also known asEpidermoid cysts","A small, round bump under the skin, usually on the face, neck or trunk, A tiny blackhead plugging the central opening of the cyst, A thick, yellow, smelly material that sometimes drains from the cyst, Redness, swelling and tenderness in the area, if inflamed or infected"
"Cysts, sebaceous, also known asEpidermoid cysts","A small, round bump under the skin, usually on the face, neck or trunk, A tiny blackhead plugging the central opening of the cyst, A thick, yellow, smelly material that sometimes drains from the cyst, Redness, swelling and tenderness in the area, if inflamed or infected"
Cytomegalovirus (CMV) infection,"Newborns who became infected with CMV before they were born (congenital CMV)., Infants who become infected during birth or shortly afterward (perinatal CMV). This group includes babies infected through breast milk., People who have weakened immune systems, such as those who have had an organ, bone marrow or stem cell transplant, or those who are infected with HIV."
"Cytomegalovirus infection, also known asCytomegalovirus (CMV) infection","Newborns who became infected with CMV before they were born (congenital CMV)., Infants who become infected during birth or shortly afterward (perinatal CMV). This group includes babies infected through breast milk., People who have weakened immune systems, such as those who have had an organ, bone marrow or stem cell transplant, or those who are infected with HIV."
Dandruff,"Skin flakes on your scalp, hair, eyebrows, beard or mustache, and shoulders, Itchy scalp, Scaly, crusty scalp in infants with cradle cap"
"Daytime sleepiness, also known asNarcolepsy","Excessive daytime sleepiness. People with narcolepsy fall asleep without warning. It can happen anywhere and at any time. It may happen when you're bored or during a task. For example, you may be working or talking with friends and suddenly fall asleep. It can be especially dangerous if you fall asleep while driving. You might fall asleep for only a few minutes or up to a half-hour. After waking, you'll often feel refreshed but you'll get sleepy again.
You also may experience a decrease in how alert and focused you feel during the day. Daytime sleepiness often is the first symptom to appear. Feeling sleepy makes it hard to focus and function.
Some people with narcolepsy continue doing a task when they fall asleep briefly. For example, you may fall asleep while writing, typing or driving. You might continue to perform that task while asleep. When you awaken, you can't remember what you did, and you probably didn't do it well., Sudden loss of muscle tone. This condition is called cataplexy. It can cause slurred speech or complete weakness of most muscles. Symptoms may last up to a few minutes.
Cataplexy can't be controlled. It's triggered by intense emotions. Often the emotions that cause cataplexy are positive. Laughter or excitement may cause the symptoms. But sometimes fear, surprise or anger can cause the loss of muscle tone. For example, when you laugh, your head may drop without your control. Or your knees may suddenly lose strength, causing you to fall.
Some people with narcolepsy experience only one or two episodes of cataplexy a year. Others have several episodes a day. Not everyone with narcolepsy has these symptoms., Sleep paralysis. People with narcolepsy often experience sleep paralysis. During sleep paralysis, you can't move or speak while falling asleep or upon waking. It's usually brief — lasting a few seconds or minutes. But it can be scary. You may be aware of it happening and can recall it afterward.
Not everyone with sleep paralysis has narcolepsy., Hallucinations. Sometimes people see things that aren't there during sleep paralysis. Hallucinations also may happen in bed without sleep paralysis. These are called hypnagogic hallucinations if they happen as you fall asleep. They're called hypnopompic hallucinations if they happen upon waking. For example, you might feel as if there is a stranger in your bedroom. These hallucinations may be vivid and frightening because you may not be fully asleep when you begin dreaming., Changes in rapid eye movement (REM) sleep. REM sleep is when most dreaming happens. Typically, people enter REM sleep 60 to 90 minutes after falling asleep. But people with narcolepsy often move more quickly to REM sleep. They tend to enter REM sleep within 15 minutes of falling asleep. REM sleep also can happen at any time of the day."
"DCIS, also known asDuctal carcinoma in situ (DCIS)","A breast lump, Bloody nipple discharge"
"DDH, also known asHip dysplasia","First pregnancy, Large baby, Breech presentation"
De Quervain tenosynovitis,"Pain near the base of the thumb, Swelling near the base of the thumb, Difficulty moving the thumb and wrist when doing something that involves grasping or pinching, A ""sticking"" or ""stop-and-go"" sensation in the thumb when moving it"
"Decreased tear production, also known asDry eyes","A stinging, burning or scratchy sensation in your eyes, Stringy mucus in or around your eyes, Sensitivity to light, Eye redness, A sensation of having something in your eyes, Difficulty wearing contact lenses, Difficulty with nighttime driving, Watery eyes, which is the body's response to the irritation of dry eyes, Blurred vision or eye fatigue"
Deep vein thrombosis (DVT),"Leg swelling, Leg pain, cramping or soreness that often starts in the calf, Change in skin color on the leg — such as red or purple, depending on the color of your skin, A feeling of warmth on the affected leg"
"Deficient color vision, also known asColor blindness","Different shades of red and green, Different shades of blue and yellow, Any colors"
