disease,symptoms
Hypercalcemia,"Kidneys. Excess calcium makes your kidneys work harder to filter it. This can cause excessive thirst and frequent urination., Digestive system. Hypercalcemia can cause stomach upset, nausea, vomiting and constipation., Bones and muscles. In most cases, the excess calcium in your blood was leached from your bones, which weakens them. This can cause bone pain and muscle weakness., Brain. Hypercalcemia can interfere with how your brain works, resulting in confusion, lethargy and fatigue. It can also cause depression., Heart. Rarely, severe hypercalcemia can interfere with your heart function, causing palpitations and fainting, indications of cardiac arrhythmia, and other heart problems."
"Hypercholesterolemia, also known asHigh cholesterol",Arcus senilis: A sign of high cholesterol?
"Hypercholesterolemia, familial, also known asFamilial hypercholesterolemia","Skin. The most common spots for cholesterol deposits to occur is on the hands, elbows and knees. They also can occur in the skin around the eyes., Tendons. Cholesterol deposits may thicken the Achilles tendon, along with some tendons in the hands., Eyes. High cholesterol levels can cause corneal arcus, a white or gray ring around the iris of the eye. This happens most commonly in older people, but it can occur in younger people who have familial hypercholesterolemia."
"Hypercortisolism, also known asCushing syndrome","Weight gain and fatty tissue deposits, particularly around the midsection and upper back, in the face (moon face), and between the shoulders (buffalo hump), Pink or purple stretch marks (striae) on the skin of the abdomen, thighs, breasts and arms, Thinning, fragile skin that bruises easily, Slow healing of cuts, insect bites and infections, Acne"
Hypereosinophilic syndrome,"Book: Mayo Clinic Family Health Book, 5th Edition, Newsletter: Mayo Clinic Health Letter — Digital Edition"
Hyperglycemia in diabetes,"Frequent urination, Increased thirst, Blurred vision, Feeling weak or unusually tired"
Hyperhidrosis,"Sweating disrupts your daily routine, Sweating causes emotional distress or social withdrawal, You suddenly begin to sweat more than usual, You experience night sweats for no apparent reason"
"Hypermenorrhea, also known asMenorrhagia (heavy menstrual bleeding)","Soaking through one or more sanitary pads or tampons every hour for several consecutive hours, Needing to use double sanitary protection to control your menstrual flow, Needing to wake up to change sanitary protection during the night, Bleeding for longer than a week, Passing blood clots larger than a quarter, Restricting daily activities due to heavy menstrual flow, Symptoms of anemia, such as tiredness, fatigue or shortness of breath"
"Hyperopia, also known asFarsightedness","Nearby objects may appear blurry, You need to squint to see clearly, You have eyestrain, including burning eyes, and aching in or around the eyes, You have general eye discomfort or a headache after doing close tasks, such as reading, writing, computer work or drawing, for a time"
Hyperoxaluria and oxalosis,"Severe or sudden back pain, Pain in the area below the ribs on the back (flank) that doesn't go away, Blood in the urine, Frequent urge to urinate, Pain when urinating, Chills or fever"
Hyperparathyroidism,"Weak bones that break easily (osteoporosis), Kidney stones, Excessive urination, Stomach (abdominal) pain, Tiring easily or weakness, Depression or forgetfulness, Bone and joint pain, Frequent complaints of illness with no clear cause, Nausea, vomiting or loss of appetite"
"Hypersexuality, also known asCompulsive sexual behavior","You have recurrent and intense sexual fantasies, urges and behaviors that take up a lot of your time and feel as if they're beyond your control., You feel driven to do certain sexual behaviors, feel a release of the tension afterward, but also feel guilt or remorse., You've tried unsuccessfully to reduce or control your sexual fantasies, urges or behavior., You use compulsive sexual behavior as an escape from other problems, such as loneliness, depression, anxiety or stress., You continue to engage in sexual behaviors that have serious consequences, such as the potential for getting or giving someone else a sexually transmitted infection, the loss of important relationships, trouble at work, financial strain, or legal problems., You have trouble establishing and maintaining healthy and stable relationships."
"Hypertension, also known asHigh blood pressure (hypertension)","Headaches, Shortness of breath, Nosebleeds"
"Hypertension, pregnancy-related, also known asPreeclampsia","Excess protein in urine (proteinuria) or other signs of kidney problems, Decreased levels of platelets in blood (thrombocytopenia), Increased liver enzymes that indicate liver problems, Severe headaches, Changes in vision, including temporary loss of vision, blurred vision or light sensitivity, Shortness of breath, caused by fluid in the lungs, Pain in the upper belly, usually under the ribs on the right side, Nausea or vomiting"
"Hypertension, pulmonary, also known asPulmonary hypertension","Blue lips and skin (cyanosis), Chest pressure or pain, Dizziness or fainting spells (syncope), Fast pulse or pounding heartbeat (palpitations), Fatigue, Shortness of breath (dyspnea), initially while exercising and eventually while at rest, Swelling (edema) in the ankles, legs and eventually the belly area (abdomen)"
Hyperthyroidism (overactive thyroid),"Losing weight without trying., Fast heartbeat, a condition called tachycardia., Irregular heartbeat, also called arrhythmia., Pounding of the heart, sometimes called heart palpitations., Increased hunger., Nervousness, anxiety and irritability., Tremor, usually a small trembling in the hands and fingers., Sweating., Changes in menstrual cycles., Increased sensitivity to heat., Changes in bowel patterns, especially more-frequent bowel movements., Enlarged thyroid gland, sometimes called a goiter, which may appear as a swelling at the base of the neck., Tiredness., Muscle weakness., Sleep problems., Warm, moist skin., Thinning skin., Fine, brittle hair."
Hypertrophic cardiomyopathy,"Chest pain, especially during exercise, Fainting, especially during or just after exercise or exertion, Heart murmur, which a health care provider might detect while listening to the heart, Sensation of fast, fluttering or pounding heartbeats (palpitations), Shortness of breath, especially during exercise"
"Hypoactive sexual desire disorder, also known asLow sex drive in women","Having no interest in any type of sexual activity, including masturbation, Never or only seldom having sexual fantasies or thoughts, Being concerned by your lack of sexual activity or fantasies"
"Hypochondria, also known asIllness anxiety disorder","Being preoccupied with having or getting a serious disease or health condition, Worrying that minor symptoms or body sensations mean you have a serious illness, Being easily alarmed about your health status, Finding little or no reassurance from doctor visits or negative test results, Worrying excessively about a specific medical condition or your risk of developing a medical condition because it runs in your family, Having so much distress about possible illnesses that it's hard for you to function, Repeatedly checking your body for signs of illness or disease, Frequently making medical appointments for reassurance — or avoiding medical care for fear of being diagnosed with a serious illness, Avoiding people, places or activities for fear of health risks, Constantly talking about your health and possible illnesses, Frequently searching the internet for causes of symptoms or possible illnesses"
Hypoglycemia,"Looking pale, Shakiness, Sweating, Headache, Hunger or nausea, An irregular or fast heartbeat, Fatigue, Irritability or anxiety, Difficulty concentrating, Dizziness or lightheadedness, Tingling or numbness of the lips, tongue or cheek"
"Hypoglycemia, diabetic, also known asDiabetic hypoglycemia","Looking pale (pallor), Shakiness, Dizziness or lightheadedness, Sweating, Hunger or nausea, An irregular or fast heartbeat, Difficulty concentrating, Feeling weak and having no energy (fatigue), Irritability or anxiety, Headache, Tingling or numbness of the lips, tongue or cheek"
"Hypohydration, also known asDehydration","Dry mouth and tongue, No tears when crying, No wet diapers for three hours, Sunken eyes, cheeks, Sunken soft spot on top of skull, Listlessness or irritability"
Hyponatremia,"Nausea and vomiting, Headache, Confusion, Loss of energy, drowsiness and fatigue, Restlessness and irritability, Muscle weakness, spasms or cramps, Seizures, Coma"
Hypoparathyroidism,"Tingling or burning in the fingertips, toes and lips, Muscle aches or cramps in the legs, feet, stomach or face, Twitching or spasms of muscles, particularly around the mouth, but also in the hands, arms and throat, Fatigue or weakness"
Hypopituitarism,"Fatigue, Muscle weakness, Changes in body fat composition, Lack of ambition, Social isolation"
Hypoplastic left heart syndrome,"Grayish-blue color of the lips and gums (cyanosis), Rapid, difficult breathing, Poor feeding, Cold hands and feet, Weak pulse, Being unusually drowsy or inactive"
Hypospadias,"Opening of the urethra at a location other than the tip of the penis, Downward curve of the penis (chordee), Hooded appearance of the penis because only the top half of the penis is covered by foreskin, Abnormal spraying during urination"
"Hypotension, also known asLow blood pressure (hypotension)","Blurred or fading vision, Dizziness or lightheadedness, Fainting, Fatigue, Trouble concentrating, Nausea"
Hypothermia,"Shivering, Slurred speech or mumbling, Slow, shallow breathing, Weak pulse, Clumsiness or lack of coordination, Drowsiness or very low energy, Confusion or memory loss, Loss of consciousness, Bright red, cold skin (in infants)"
Hypothyroidism (underactive thyroid),"Tiredness., More sensitivity to cold., Constipation., Dry skin., Weight gain., Puffy face., Hoarse voice., Coarse hair and skin., Muscle weakness., Muscle aches, tenderness and stiffness., Menstrual cycles that are heavier than usual or irregular., Thinning hair., Slowed heart rate, also called bradycardia., Depression., Memory problems."
"IBD, also known asInflammatory bowel disease (IBD)","Diarrhea, Fatigue, Abdominal pain and cramping, Blood in your stool, Reduced appetite, Unintended weight loss"
"IBS, also known asIrritable bowel syndrome","Abdominal pain, cramping or bloating that is related to passing a bowel movement, Changes in appearance of bowel movement, Changes in how often you are having a bowel movement"
"Idiopathic intracranial hypertension, also known asPseudotumor cerebri (idiopathic intracranial hypertension)","Often severe headaches that might originate behind your eyes, A whooshing sound in your head that pulses with your heartbeat, Nausea, vomiting or dizziness, Vision loss, Brief episodes of blindness, lasting a few seconds and affecting one or both eyes, Difficulty seeing to the side, Double vision, Seeing light flashes, Neck, shoulder or back pain"
"Idiopathic myelofibrosis, also known asMyelofibrosis","Feeling tired, weak or short of breath, usually because of anemia, Pain or fullness below your ribs on the left side, due to an enlarged spleen, Easy bruising, Easy bleeding, Excessive sweating during sleep (night sweats), Fever, Bone pain"
"Idiopathic thrombocytopenic purpura, also known asImmune thrombocytopenia (ITP)","Easy or excessive bruising, Superficial bleeding into the skin that appears as pinpoint-sized reddish-purple spots (petechiae) that look like a rash, usually on the lower legs, Bleeding from the gums or nose, Blood in urine or stools, Unusually heavy menstrual flow"
"Idiopathic toe walking, also known asToe walking in children","A short Achilles tendon. This tendon links the lower leg muscles to the back of the heel bone. If it's too short, it can prevent the heel from touching the ground., Cerebral palsy. Toe walking can be caused by a disorder of movement, muscle tone or posture caused by injury or abnormal development in the parts of the immature brain that control muscle function., Muscular dystrophy. Toe walking sometimes occurs in this genetic disease in which muscle fibers are unusually prone to damage and weaken over time. This diagnosis might be more likely if your child initially walked normally before starting to toe walk., Autism. Toe walking has been linked to autism spectrum disorders, which affect a child's ability to communicate and interact with others."
IgA nephropathy (Berger's disease),"Cola- or tea-colored urine (caused by red blood cells in the urine), Repeated episodes of cola- or tea-colored urine, and sometimes visible blood in your urine, usually during or after an upper respiratory or other infection and sometimes after strenuous exercise, Foamy urine from protein leaking into your urine (proteinuria), Pain in the one or both sides of your back below your ribs, Swelling (edema) in your hands and feet, High blood pressure"
"IgA vasculitis, also known asHenoch-Schonlein purpura","Rash (purpura). Reddish-purple spots that look like bruises develop on the buttocks, legs and feet. The rash can also appear on the arms, face and trunk and may be worse in areas of pressure, such as the sock line and waistline., Swollen, sore joints (arthritis). People with Henoch-Schonlein purpura often have pain and swelling around the joints — mainly in the knees and ankles. Joint pain sometimes precedes the classical rash by one or two weeks. These symptoms subside when the disease clears and leave no lasting damage., Digestive tract symptoms. Many children with Henoch-Schonlein purpura develop belly pain, nausea, vomiting and bloody stools. These symptoms sometimes occur before the rash appears., Kidney involvement. Henoch-Schonlein purpura can also affect the kidneys. In most cases, this shows up as protein or blood in the urine, which you may not even know is there unless you have a urine test done. Usually this goes away once the illness passes, but some people develop persistent kidney disease."
"IIH, also known asPseudotumor cerebri (idiopathic intracranial hypertension)","Often severe headaches that might originate behind your eyes, A whooshing sound in your head that pulses with your heartbeat, Nausea, vomiting or dizziness, Vision loss, Brief episodes of blindness, lasting a few seconds and affecting one or both eyes, Difficulty seeing to the side, Double vision, Seeing light flashes, Neck, shoulder or back pain"
Illness anxiety disorder,"Being preoccupied with having or getting a serious disease or health condition, Worrying that minor symptoms or body sensations mean you have a serious illness, Being easily alarmed about your health status, Finding little or no reassurance from doctor visits or negative test results, Worrying excessively about a specific medical condition or your risk of developing a medical condition because it runs in your family, Having so much distress about possible illnesses that it's hard for you to function, Repeatedly checking your body for signs of illness or disease, Frequently making medical appointments for reassurance — or avoiding medical care for fear of being diagnosed with a serious illness, Avoiding people, places or activities for fear of health risks, Constantly talking about your health and possible illnesses, Frequently searching the internet for causes of symptoms or possible illnesses"
Immune thrombocytopenia (ITP),"Easy or excessive bruising, Superficial bleeding into the skin that appears as pinpoint-sized reddish-purple spots (petechiae) that look like a rash, usually on the lower legs, Bleeding from the gums or nose, Blood in urine or stools, Unusually heavy menstrual flow"
"Immune thrombocytopenic purpura, also known asImmune thrombocytopenia (ITP)","Easy or excessive bruising, Superficial bleeding into the skin that appears as pinpoint-sized reddish-purple spots (petechiae) that look like a rash, usually on the lower legs, Bleeding from the gums or nose, Blood in urine or stools, Unusually heavy menstrual flow"
Impacted wisdom teeth,"Red or swollen gums, Tender or bleeding gums, Jaw pain, Swelling around the jaw, Bad breath, An unpleasant taste in your mouth, Difficulty opening your mouth"
"Impaired glucose tolerance, also known asPrediabetes","Increased thirst, Frequent urination, Increased hunger, Fatigue, Blurred vision, Numbness or tingling in the feet or hands, Frequent infections, Slow-healing sores, Unintended weight loss"
Impetigo,"Age. Impetigo occurs most commonly in children ages 2 to 5., Close contact. Impetigo spreads easily within families, in crowded settings, such as schools and child care facilities, and from participating in sports that involve skin-to-skin contact., Warm, humid weather. Impetigo infections are more common in warm, humid weather., Broken skin. The bacteria that cause impetigo often enter the skin through a small cut, insect bite or rash., Other health conditions. Children with other skin conditions, such as atopic dermatitis (eczema), are more likely to develop impetigo. Older adults, people with diabetes or people with a weakened immune system are also more likely to get it."
"Impotence, also known asErectile dysfunction","Trouble getting an erection, Trouble keeping an erection, Reduced sexual desire"
Incompetent cervix,"A sensation of pelvic pressure, A new backache, Mild abdominal cramps, A change in vaginal discharge, Light vaginal bleeding"
"Incomplete fracture, also known asGreenstick fractures",Greenstick fracture
"Incontinence, bowel, also known asFecal incontinence","Diarrhea., Constipation., Gas and bloating."
"Incontinence, fecal, also known asFecal incontinence","Diarrhea., Constipation., Gas and bloating."
"Incontinence, nighttime, also known asBed-wetting","Your child still wets the bed after age 7, Your child starts to wet the bed after a few months of being dry at night, Bed-wetting is accompanied by painful urination, unusual thirst, pink or red urine, hard stools, or snoring"
"Incontinence, urinary, also known asUrinary incontinence","Stress incontinence. Urine leaks when you exert pressure on your bladder by coughing, sneezing, laughing, exercising or lifting something heavy., Urge incontinence. You have a sudden, intense urge to urinate followed by an involuntary loss of urine. You may need to urinate often, including throughout the night. Urge incontinence may be caused by a minor condition, such as infection, or a more severe condition such as a neurological disorder or diabetes., Overflow incontinence. You experience frequent or constant dribbling of urine due to a bladder that doesn't empty completely., Functional incontinence. A physical or mental impairment keeps you from making it to the toilet in time. For example, if you have severe arthritis, you may not be able to unbutton your pants quickly enough., Mixed incontinence. You experience more than one type of urinary incontinence — most often this refers to a combination of stress incontinence and urge incontinence."
Indigestion,"Early fullness during a meal. You haven't eaten much of your meal, but you already feel full and may not be able to finish eating., Uncomfortable fullness after a meal. The feeling of fullness lasts longer than it should., Discomfort in the upper abdomen. You feel a mild to severe pain in the area between the bottom of your breastbone and your bellybutton., Burning in the upper abdomen. You feel an uncomfortable heat or burning sensation between the bottom of your breastbone and your bellybutton., Bloating in the upper abdomen. You feel an uncomfortable sensation of tightness in your upper abdomen., Nausea. You feel as if you want to vomit."
Infant jaundice,"Your baby's skin becomes more yellow, The skin on your baby's the abdomen, arms or legs looks yellow, The whites of your baby's eyes look yellow, Your baby seems listless or sick or is difficult to awaken, Your baby isn't gaining weight or is feeding poorly, Your baby makes high-pitched cries, Your baby develops any other signs or symptoms that concern you"
Infant reflux,"Isn't gaining weight., Consistently spits up forcefully, causing stomach contents to shoot out of the mouth. This is called projectile vomiting., Spits up green or yellow fluid., Spits up blood or stomach contents that look like coffee grounds., Refuses to feed or eat., Has blood in the stool., Has difficulty breathing or a cough that won't go away., Begins spitting up at age 6 months or older., Is unusually irritable after eating., Doesn't have much energy."
"Infantile hemangioma, also known asHemangioma","Hemangioma, Infantile Hemangiomas- aka ""Strawberry"" Birthmarks"
"Infectious arthritis, also known asSeptic arthritis","Existing joint problems. Chronic diseases and conditions that affect your joints — such as osteoarthritis, gout, rheumatoid arthritis or lupus — can increase your risk of septic arthritis, as can previous joint surgery and joint injury., Having an artificial joint. Bacteria can be introduced during joint replacement surgery, or an artificial joint may become infected if germs travel to the joint from a different area of the body through the bloodstream., Taking medications for rheumatoid arthritis. People with rheumatoid arthritis have a further increase in risk because of medications they take that can suppress the immune system, making infections more likely to occur. Diagnosing septic arthritis in people with rheumatoid arthritis is difficult because many of the signs and symptoms are similar., Skin fragility. Skin that breaks easily and heals poorly can give bacteria access to your body. Skin conditions such as psoriasis and eczema increase your risk of septic arthritis, as do infected skin wounds. People who regularly inject drugs also have a higher risk of infection at the site of injection., Weak immune system. People with a weak immune system are at greater risk of septic arthritis. This includes people with diabetes, kidney and liver problems, and those taking drugs that suppress their immune systems., Joint trauma. Animal bites, puncture wounds or cuts over a joint can put you at risk of septic arthritis."
Infectious diseases,"Fever, Diarrhea, Fatigue, Muscle aches, Coughing"
Infertility,"Are age 35 or older and have been trying to conceive for six months or longer, Are over age 40, Have irregular or absent periods, Have very painful periods, Have known fertility problems, Have been diagnosed with endometriosis or pelvic inflammatory disease, Have had multiple miscarriages, Have undergone treatment for cancer"
"Infertility, female, also known asFemale infertility","Up to age 35, most doctors recommend trying to get pregnant for at least a year before testing or treatment., If you're between 35 and 40, discuss your concerns with your doctor after six months of trying., If you're older than 40, your doctor might suggest testing or treatment right away."
"Infertility, male, also known asMale infertility","Problems with sexual function — for example, difficulty with ejaculation or small volumes of fluid ejaculated, reduced sexual desire, or difficulty maintaining an erection (erectile dysfunction), Pain, swelling or a lump in the testicle area, Recurrent respiratory infections, Inability to smell, Abnormal breast growth (gynecomastia), Decreased facial or body hair or other signs of a chromosomal or hormonal abnormality, A lower than normal sperm count (fewer than 15 million sperm per milliliter of semen or a total sperm count of less than 39 million per ejaculate)"
Inflammatory bowel disease (IBD),"Diarrhea, Fatigue, Abdominal pain and cramping, Blood in your stool, Reduced appetite, Unintended weight loss"
Inflammatory breast cancer,"Rapid change in the appearance of one breast, over the course of several weeks, Thickness, heaviness or visible enlargement of one breast, Discoloration, giving the breast a red, purple, pink or bruised appearance, Unusual warmth of the affected breast, Dimpling or ridges on the skin of the affected breast, similar to an orange peel, Tenderness, pain or aching, Enlarged lymph nodes under the arm, above the collarbone or below the collarbone, Flattening or turning inward of the nipple"
"Inflammed gallbladder, also known asCholecystitis","Severe pain in your upper right or center abdomen, Pain that spreads to your right shoulder or back, Tenderness over your abdomen when it's touched, Nausea, Vomiting, Fever"
"Inflammed pancreas, also known asPancreatitis","Upper abdominal pain, Abdominal pain that radiates to your back, Tenderness when touching the abdomen, Fever, Rapid pulse, Nausea, Vomiting"
"Inflammed pericardium, also known asPericarditis","Spread to the left shoulder and neck, Get worse when coughing, lying down or taking a deep breath, Get better when sitting up or leaning forward"
Influenza (flu),"Fever, Aching muscles, Chills and sweats, Headache, Dry, persistent cough, Shortness of breath, Tiredness and weakness, Runny or stuffy nose, Sore throat, Eye pain, Vomiting and diarrhea, but this is more common in children than adults"
"Influenza, H1N1, also known asH1N1 flu (swine flu)","Fever, but not always., Aching muscles., Chills and sweats., Cough., Sore throat., Runny or stuffy nose., Watery, red eyes., Eye pain., Body aches., Headache., Tiredness and weakness., Diarrhea., Feeling sick to the stomach, vomiting, but this is more common in children than adults."
"Influenza, swine flu, also known asH1N1 flu (swine flu)","Fever, but not always., Aching muscles., Chills and sweats., Cough., Sore throat., Runny or stuffy nose., Watery, red eyes., Eye pain., Body aches., Headache., Tiredness and weakness., Diarrhea., Feeling sick to the stomach, vomiting, but this is more common in children than adults."
